title,company,location,link
Software Entwickler (m/w/d) Schwerpunkt Scala / TypeScript / AWS,Süddeutsche Zeitung Digitale Medien GmbH,"München, Deutschland",https://stackoverflow.com/jobs/487076
Senior Software Engineer/SRE - Trading Analytics,Bloomberg LP,"London, UK",https://stackoverflow.com/jobs/551412
Full Stack Java Software Engineer,"JPMorgan Chase Bank, N.A.","Plano, TX",https://stackoverflow.com/jobs/553943
Senior Front-End JavaScript Engineer,Canva,"Sydney, Australia",https://stackoverflow.com/jobs/150823
Software Engineers,Eurovision Services,"Madrid, Spain",https://stackoverflow.com/jobs/504593
Sr. Front-End Software Developer,ProQuest,No office location,https://stackoverflow.com/jobs/555479
Software Engineering,"JPMorgan Chase Bank, N.A.","Glasgow, UK",https://stackoverflow.com/jobs/553856
Full Stack Mobile Developer (Flutter) (w/m/d),Lotum GmbH,"Frankfurt am Main, Deutschland",https://stackoverflow.com/jobs/526742
Full Stack Engineer,Labforward GmbH,"Berlin, Germany",https://stackoverflow.com/jobs/553112
Senior Fullstack Developer (m/w/d) - für E-Commerce Agentur in Bremen,hmmh multimediahaus AG,"Bremen, Deutschland",https://stackoverflow.com/jobs/527118
Fullstack Developer (m/w/d) remote,best it AG,"Berlin, Deutschland",https://stackoverflow.com/jobs/512059
Senior Back-End Engineer,Labforward GmbH,"Berlin, Germany",https://stackoverflow.com/jobs/500199
Senior Software Engineer- Order Management System- R10501,"Chewy, Inc.","Boston, MA",https://stackoverflow.com/jobs/555654
Web Developer wanting to join a fast growing company,BigChange Ltd,"Leeds, UK",https://stackoverflow.com/jobs/268103
Full-Stack Developer,FlexEarn,"London, UK",https://stackoverflow.com/jobs/485775
Full-Stack Developer C# .NET / Angular,digitalklang,"Berlin, Germany",https://stackoverflow.com/jobs/552150
Junior Software Engineer,Akselos S.A.,"Ho Chi Minh City, Vietnam",https://stackoverflow.com/jobs/411389
Werkstudent*in (w/m/d) - Softwareentwicklung,1&1 Mail & Media Applications SE - WEB.DE | GMX | 1&1 | mail.com,"Karlsruhe, Deutschland",https://stackoverflow.com/jobs/526847
Front-end Developer,HOTMART,"Belo Horizonte, Brazil",https://stackoverflow.com/jobs/526776
Senior Front-end Engineer,Reaktor,"Lisboa, Portugal",https://stackoverflow.com/jobs/554381
Software Engineering,"JPMorgan Chase Bank, N.A.","Chicago, IL",https://stackoverflow.com/jobs/555792
Javascript Engineer,Adaptavist,"London, UK",https://stackoverflow.com/jobs/522044
Remote: Contract Senior Frontend Engineer,The Sensible Code Company,"Belfast, UK",https://stackoverflow.com/jobs/553617
Mid Level C# Developer,Dynamic Planner,"Reading, UK",https://stackoverflow.com/jobs/538309
React / Python Full Stack Software Engineer,"JPMorgan Chase Bank, N.A.","Jersey City, NJ",https://stackoverflow.com/jobs/554980
Web Developer (m/f/d),Ravensburger AG,"Seattle, WA, USA",https://stackoverflow.com/jobs/497853
Software Developers -  Gaming Tech,Derivco.,"Douglas, Isle of Man",https://stackoverflow.com/jobs/551468
Senior Full-Stack Developer,Kodify Media Group,No office location,https://stackoverflow.com/jobs/542034
Senior Frontend Engineer,Hyperexponential,"London, UK",https://stackoverflow.com/jobs/554263
Senior Software Engineer - Frontend Engineer - Remote Optional,Tenet3,"Dayton, OH",https://stackoverflow.com/jobs/535000
Software Engineering,"JPMorgan Chase Bank, N.A.","Glasgow, UK",https://stackoverflow.com/jobs/555766
Front-end Developer,Jumbo Supermarkets,"Veghel, Netherlands",https://stackoverflow.com/jobs/535306
Principal Software Engineer (R9380),"Chewy, Inc.","Minneapolis, MN",https://stackoverflow.com/jobs/526632
Frontend Developer (m/w/d) – Karlsruhe oder 100% Remote,Sovendus GmbH,"Karlsruhe, Deutschland",https://stackoverflow.com/jobs/552514
Lead Software Engineer (Full Stack),"Jack Henry & Associates, Inc.®",No office location,https://stackoverflow.com/jobs/541319
Engineering Lead - Cairo - Egypt,Vezeeta,"Masr Al Jadidah, Egypt",https://stackoverflow.com/jobs/373791
Backend Engineer - Tradeshift Engage,Tradeshift,"Aarhus, Denmark",https://stackoverflow.com/jobs/526909
"Senior Software Engineer (3 Teams- PHP backend, Typescript and Frontend Team)",Virtasant Inc,No office location,https://stackoverflow.com/jobs/550229
Backend Developer (m/w/d) remote,best it AG,"Berlin, Deutschland",https://stackoverflow.com/jobs/513393
Frontend Entwickler (w/m/d) Angular / Typescript - bundesweit & Homeoffice,objective partner AG,"Weinheim, Deutschland",https://stackoverflow.com/jobs/550883
Intermediate Front-End Developer,Derivco.,"Umhlanga, South Africa",https://stackoverflow.com/jobs/528641
Senior Front End Developer,Cloudwise B.V.,"Woerden, Netherlands",https://stackoverflow.com/jobs/541477
UX / Front End Developer,"JPMorgan Chase Bank, N.A.","Tampa, FL",https://stackoverflow.com/jobs/555865
Software Engineer Web Front-end Product Development,ti&m AG,"Zürich, Schweiz",https://stackoverflow.com/jobs/522335
Staff Backend Engineer (US Only),"Pie Insurance Holdings, Inc.",No office location,https://stackoverflow.com/jobs/545527
DevOps Engineer,Invitae Corporation,"Boulder, CO",https://stackoverflow.com/jobs/522515
Remote Java Developer,O'Reilly Auto Parts,No office location,https://stackoverflow.com/jobs/554577
Software Entwickler (m/w/d) Schwerpunkt Scala / TypeScript / AWS,Süddeutsche Zeitung Digitale Medien GmbH,"München, Deutschland",https://stackoverflow.com/jobs/487076
"Full Stack Engineer(Java, Node.js, Docker, Kubernetes, Jenkins)",buildit,"Bengaluru, India",https://stackoverflow.com/jobs/552506
Contract Remote Java / React Developer (US Based Citizen/Green Card),Intevity,No office location,https://stackoverflow.com/jobs/551329
Full Stack Web Application / Software Developer (.NET) (m/w/d),JSP International,"Düsseldorf, Deutschland",https://stackoverflow.com/jobs/550550
Full Stack Java Developer - Angular/Microservices,"JPMorgan Chase Bank, N.A.","Plano, TX",https://stackoverflow.com/jobs/555862
Sr. UI Developer,"JPMorgan Chase Bank, N.A.","Plano, TX",https://stackoverflow.com/jobs/551955
Software Engineers,Eurovision Services,"Madrid, Spain",https://stackoverflow.com/jobs/504593
Software Engineering,"JPMorgan Chase Bank, N.A.","Houston, TX",https://stackoverflow.com/jobs/552459
Software Engineering,"JPMorgan Chase Bank, N.A.","Glasgow, UK",https://stackoverflow.com/jobs/553856
Frontend Engineer,SQUAD,"Kyiv, Ukraine",https://stackoverflow.com/jobs/518176
Lead / Senior Frontend Web Developer,Network Guard,Singapore,https://stackoverflow.com/jobs/527720
Full Stack Engineer,Labforward GmbH,"Berlin, Germany",https://stackoverflow.com/jobs/553112
"Java Software Engineer - Groovy, Grails and Bootstrap",Allied Outdoor Solutions,"Houston, TX",https://stackoverflow.com/jobs/552177
Senior Fullstack Developer (m/w/d) - für E-Commerce Agentur in Bremen,hmmh multimediahaus AG,"Bremen, Deutschland",https://stackoverflow.com/jobs/527118
Full-Stack Developer (React & Node.js),Seven Peaks Software,"Khwaeng Khlong Toei, Thailand",https://stackoverflow.com/jobs/474102
Senior Back-End Engineer,Labforward GmbH,"Berlin, Germany",https://stackoverflow.com/jobs/500199
"Senior JavaScript Engineer (Remote, Canada)",Fullscript,No office location,https://stackoverflow.com/jobs/555260
"Full Stack Software Engineer, Web Developer",People Data Labs,"San Francisco, CA",https://stackoverflow.com/jobs/552699
Sr. Software Engineer,Ceros,No office location,https://stackoverflow.com/jobs/545096
React - Front End Developer,Kindred Group PLC,"Stockholm, Sweden",https://stackoverflow.com/jobs/544512
React - Front End Developer,Kindred Group PLC,"London, UK",https://stackoverflow.com/jobs/544509
Front End Software Engineer,ErisX,"Chicago, IL",https://stackoverflow.com/jobs/546356
Full Stack Developer (m/w/d),"Sthree GmbHviaProgressive, ein Geschäftszweig der SThree GmbH","Dortmund, Deutschland",https://stackoverflow.com/jobs/524038
Full-Stack Developer C# .NET / Angular,digitalklang,"Berlin, Germany",https://stackoverflow.com/jobs/552150
Web Producer,Computer FuturesviaComputer Futures US,"San Francisco, CA",https://stackoverflow.com/jobs/525011
UX / Front End Developer,"JPMorgan Chase Bank, N.A.","Tampa, FL",https://stackoverflow.com/jobs/555865
Web Entwickler (m/w/d) mit React Erfahrung als Verstärkung gesucht,Bolinda Labs GmbH,"Darmstadt, Deutschland",https://stackoverflow.com/jobs/235595
React Developer (m/f/d),ProSiebenSat.1 Media SE,"München, Deutschland",https://stackoverflow.com/jobs/524218
Senior Software .Net Developer,SITA,"Dayton, OH",https://stackoverflow.com/jobs/548758
Sr. Front End Developer - Angular,"loanDepot, LLC","Irvine, CA",https://stackoverflow.com/jobs/505661
Backend Engineer -Working in Japan,LINE Fukuoka,"Fukuoka, Japan",https://stackoverflow.com/jobs/273843
Full Stack Java Developer - Angular/Microservices,"JPMorgan Chase Bank, N.A.","Plano, TX",https://stackoverflow.com/jobs/555862
Senior Professional Frontend Developer 80 - 100% (w/m),dormakaba International Holding AG,"Rümlang, Switzerland",https://stackoverflow.com/jobs/555128
Senior Full-stack Laravel/React/MySQL developer,Scalable Path,No office location,https://stackoverflow.com/jobs/533180
Web/Mobile Developer (m/w/d),Dedalus HealthCare Systems Group,"Trier, Deutschland",https://stackoverflow.com/jobs/482358
Software Engineer,"JPMorgan Chase Bank, N.A.","Plano, TX",https://stackoverflow.com/jobs/555775
Senior Software Engineer / Ruby or Elixir/ Remote,The RealReal,No office location,https://stackoverflow.com/jobs/522850
Developer Frontend/ Backend/ Fullstack m/w/d,MARC O'POLO International GmbH,"Stephanskirchen, Deutschland",https://stackoverflow.com/jobs/519513
Senior Software Developer Web (m/w/d) - Meckenheim (Bonn) / remote,"SThree Temp ExpertsviaProgressive, ein Geschäftszweig der SThree GmbH","Meckenheim, Deutschland",https://stackoverflow.com/jobs/524024
(Senior) Full Stack Engineer (f/m/d),CoachHub GmbH,No office location,https://stackoverflow.com/jobs/504203
Frontend Engineer (Angular) - Cloud Telephony (m/f/d),NFON AG,"Berlin, Deutschland",https://stackoverflow.com/jobs/505668
Senior Webentwickler/in (80-100%),bbv Software Services AG,"Zürich, Schweiz",https://stackoverflow.com/jobs/431192
Software Engineer (C++ and/or Java),"JPMorgan Chase Bank, N.A.","Houston, TX",https://stackoverflow.com/jobs/553513
Backend Engineer - Tradeshift Engage,Tradeshift,"Aarhus, Denmark",https://stackoverflow.com/jobs/526909
Java Fullstack Entwickler (w/m/d) - bundesweit & Homeoffice,objective partner AG,"Weinheim, Deutschland",https://stackoverflow.com/jobs/550879
"Senior Software Engineer (3 Teams- PHP backend, Typescript and Frontend Team)",Virtasant Inc,No office location,https://stackoverflow.com/jobs/550229
Java Software engineer,ProgressiveviaProgressive Staffing Netherlands,"Amsterdam, Netherlands",https://stackoverflow.com/jobs/530992
Full Stack Developer,Banjo Robinson,"London, UK",https://stackoverflow.com/jobs/554524
Front End Engineer,"JPMorgan Chase Bank, N.A.","Plano, TX",https://stackoverflow.com/jobs/554205
Java Software Engineer,"JPMorgan Chase Bank, N.A.","Columbus, OH",https://stackoverflow.com/jobs/553176
Junior Java fejlesztő,UNIQA Raiffeisen Software Service Kft.,"Budapest, Ungarn",https://stackoverflow.com/jobs/515491
Senior Front End Developer,Cloudwise B.V.,"Woerden, Netherlands",https://stackoverflow.com/jobs/541477
Software Engineering,"JPMorgan Chase Bank, N.A.","Jersey City, NJ",https://stackoverflow.com/jobs/554639
Cloud Native Java Software Engineering,"JPMorgan Chase Bank, N.A.","Chicago, IL",https://stackoverflow.com/jobs/552671
Senior Software Engineer - Full Stack Java,MUFG,"Tempe, AZ",https://stackoverflow.com/jobs/534773
Full Stack Senior Software Engineer,"JPMorgan Chase Bank, N.A.","Chicago, IL",https://stackoverflow.com/jobs/551890
Software Engineering,"JPMorgan Chase Bank, N.A.","Jersey City, NJ",https://stackoverflow.com/jobs/554639
Cloud Native Java Software Engineering,"JPMorgan Chase Bank, N.A.","Chicago, IL",https://stackoverflow.com/jobs/552671
Senior Software Engineer - Full Stack Java,MUFG,"Tempe, AZ",https://stackoverflow.com/jobs/534773
Full Stack Entwickler (m/w/d) mit React und Spring Boot als Verstärkung gesucht,Bolinda Labs GmbH,"Darmstadt, Deutschland",https://stackoverflow.com/jobs/252224
C# Webentwickler,MENTZ GmbH,"München, Deutschland",https://stackoverflow.com/jobs/515965
Full-Stack-Entwickler in der Multimedia-Redaktion (m/w/d),Frankfurter Allgemeine Zeitung GmbH (F.A.Z.),"Frankfurt am Main, Deutschland",https://stackoverflow.com/jobs/546692
Front end Data Visualisation Engineer,Neo4j,"London, UK",https://stackoverflow.com/jobs/501802
Senior C# Full stack S/W Developer,Dynamic Planner,"Reading, UK",https://stackoverflow.com/jobs/538306
JavaScript Developer (m/w/d) Full Stack,ZEIT Verlagsgruppe,"München, Deutschland",https://stackoverflow.com/jobs/545914
Frontend Entwickler (w/m/d) React / JavaScript - bundesweit & Homeoffice,objective partner AG,"Weinheim, Deutschland",https://stackoverflow.com/jobs/550884
Sr. UI Developer,"JPMorgan Chase Bank, N.A.","Plano, TX",https://stackoverflow.com/jobs/551955
Sr. Web Developer - Knowledge Graphs,Esri,"Redlands, CA",https://stackoverflow.com/jobs/523773
Lead / Senior Frontend Web Developer,Network Guard,Singapore,https://stackoverflow.com/jobs/527720
Softwareentwickler Frontend (w/m/d) Karlsruhe/Bielefeld,STARFACE GmbH,"Karlsruhe, Deutschland",https://stackoverflow.com/jobs/546434
Software Engineering,"JPMorgan Chase Bank, N.A.","Houston, TX",https://stackoverflow.com/jobs/552459
Senior Full-Stack Developer,Derivco.,"Umhlanga, South Africa",https://stackoverflow.com/jobs/528652
"Vice President, Software Engineering (Front-end) | Corporate & Investment Banking...","JPMorgan Chase Bank, N.A.","Plano, TX",https://stackoverflow.com/jobs/554487
Senior Frontend Engineer | Angular or React | Barcelona,Dynatrace,"Barcelona, Spain",https://stackoverflow.com/jobs/546676
Software Engineering - Full Stack Java,"JPMorgan Chase Bank, N.A.","Jersey City, NJ",https://stackoverflow.com/jobs/554791
Software Architect,Derivco.,"Umhlanga, South Africa",https://stackoverflow.com/jobs/528637
Software Engineer - Java / Oracle,MUFG,"Tempe, AZ",https://stackoverflow.com/jobs/538133
Java Software Engineer,"JPMorgan Chase Bank, N.A.","Chicago, IL",https://stackoverflow.com/jobs/554007
Software Engineering - Lead,"JPMorgan Chase Bank, N.A.","Tampa, FL",https://stackoverflow.com/jobs/554937
Développeur Angular / Java,Digital4Better,"Paris, France",https://stackoverflow.com/jobs/515925
Java FullStack SE - Looking to disrupt the Mortgage Industry!,"Cardinal Financial Company, LP",No office location,https://stackoverflow.com/jobs/350467
Java Fullstack Entwickler (w/m/d) - bundesweit & Homeoffice,objective partner AG,"Weinheim, Deutschland",https://stackoverflow.com/jobs/550879
Full Stack Developer,Banjo Robinson,"London, UK",https://stackoverflow.com/jobs/554524
Senior Web Angular Developer,MHR,"Nottingham, UK",https://stackoverflow.com/jobs/524829
Software-Entwickler mit Web- & App-Schwerpunkt (m/w/d),Method Park,"Erlangen, Deutschland",https://stackoverflow.com/jobs/526320
Frontend Entwickler (w/m/d) Angular / Typescript - bundesweit & Homeoffice,objective partner AG,"Weinheim, Deutschland",https://stackoverflow.com/jobs/550883
Backend Engineer -Working in Japan,LINE Fukuoka,"Fukuoka, Japan",https://stackoverflow.com/jobs/273843
Software Engineering - Capacity Analytics,"JPMorgan Chase Bank, N.A.","Plano, TX",https://stackoverflow.com/jobs/553378
Software Engineer (Java and/or C++),"JPMorgan Chase Bank, N.A.","Houston, TX",https://stackoverflow.com/jobs/552478
Tech Lead Backend Development (m/f/d),"AppLike Group - justDice, adjoe and Sunday","Hamburg, Deutschland",https://stackoverflow.com/jobs/531049
Software Engineer - Java,"JPMorgan Chase Bank, N.A.","Glasgow, UK",https://stackoverflow.com/jobs/555060
Software Engineering,"JPMorgan Chase Bank, N.A.","Jersey City, NJ",https://stackoverflow.com/jobs/554639
Full Stack Engineer (Application Engineer),Rakuten,"Setagaya City, Japan",https://stackoverflow.com/jobs/527726
Senior Java Software Engineer - Team Lead,"JPMorgan Chase Bank, N.A.","Houston, TX",https://stackoverflow.com/jobs/554475
C# Webentwickler,MENTZ GmbH,"München, Deutschland",https://stackoverflow.com/jobs/515965
Senior Software Engineer - Macro Markets & Alternative Data,Bloomberg LP,"New York, NY",https://stackoverflow.com/jobs/523353
Senior Software Engineer,"JPMorgan Chase Bank, N.A.","Wilmington, DE",https://stackoverflow.com/jobs/554011
Senior Software Engineer,"JPMorgan Chase Bank, N.A.","Wilmington, DE",https://stackoverflow.com/jobs/554010
MOBILE APP DEVELOPER (m/w/x),Axess AG,"Anif, Österreich",https://stackoverflow.com/jobs/457890
AEM Lead Developer,"JPMorgan Chase Bank, N.A.","Jersey City, NJ",https://stackoverflow.com/jobs/553396
Senior JavaScript Developer,Accenture Romania,"Bucharest, Romania",https://stackoverflow.com/jobs/525564
Senior Frontend Entwickler mit Schwerpunkt Angular (m/w/d),Flossbach von Storch AG,"Köln, Deutschland",https://stackoverflow.com/jobs/553418
Software Engineering,"JPMorgan Chase Bank, N.A.","Chicago, IL",https://stackoverflow.com/jobs/553677
Sr. Web Developer - Knowledge Graphs,Esri,"Redlands, CA",https://stackoverflow.com/jobs/523773
Front End Developer (m/f/d) REMOTE possible,Retresco GmbH,"Berlin, Deutschland",https://stackoverflow.com/jobs/487856
React/JS Full Stack Developer,"JPMorgan Chase Bank, N.A.","Houston, TX",https://stackoverflow.com/jobs/553212
Lead Software Engineer,"JPMorgan Chase Bank, N.A.","Wilmington, DE",https://stackoverflow.com/jobs/554008
Senior Software Engineer - Macro Markets & Alternative Data,Bloomberg LP,"New York, NY",https://stackoverflow.com/jobs/523353
Senior Software Engineer,"JPMorgan Chase Bank, N.A.","Wilmington, DE",https://stackoverflow.com/jobs/554011
Senior Software Engineer,Viva Wallet,"Marousi, Greece",https://stackoverflow.com/jobs/541474
Senior Frontend Entwickler mit Schwerpunkt Angular (m/w/d),Flossbach von Storch AG,"Köln, Deutschland",https://stackoverflow.com/jobs/553418
Software Engineering,"JPMorgan Chase Bank, N.A.","Jersey City, NJ",https://stackoverflow.com/jobs/553980
Software Engineering - ACE 1,"JPMorgan Chase Bank, N.A.","Plano, TX",https://stackoverflow.com/jobs/554941
Senior Frontend Engineer (React),Rodeo,"Amsterdam, Netherlands",https://stackoverflow.com/jobs/516002
Principal Software Engineer (Fully Remote) E-Comm experience required,The RealReal,"San Francisco, CA",https://stackoverflow.com/jobs/524509
Software Engineering,"JPMorgan Chase Bank, N.A.","Glasgow, UK",https://stackoverflow.com/jobs/555227
Mid Level Software Engineer,Synaptech,"Colorado Springs, CO",https://stackoverflow.com/jobs/553468
E-Trading Application Developer (Java/C++/Front-End),"JPMorgan Chase Bank, N.A.","Chicago, IL",https://stackoverflow.com/jobs/553681
Software Engineer Fullstack,PedidosYa,No office location,https://stackoverflow.com/jobs/553001
UX Developer,Portland Webworks,"Portland, ME",https://stackoverflow.com/jobs/524306
Web Engineer,Numbrs,No office location,https://stackoverflow.com/jobs/524105
"PHP, Symfony, Sylius Junior Software Entwickler (m/w) 80-10",cloudtec AG,"Bern, Schweiz",https://stackoverflow.com/jobs/546432
Software Engineering,"JPMorgan Chase Bank, N.A.","Wilmington, DE",https://stackoverflow.com/jobs/554794
"(100% Remote) Senior Front-end Engineer, Growth Engineering Squad",Toptal,No office location,https://stackoverflow.com/jobs/534698
Associate Software Engineer,FinancialForce.com,No office location,https://stackoverflow.com/jobs/493905
Senior Full Stack Software Engineer,Daily Kos,"Oakland, CA",https://stackoverflow.com/jobs/555460
Senior Full Stack Engineer,Just eat Takeaway.com,"London, UK",https://stackoverflow.com/jobs/549101
Software Engineer - Java,"JPMorgan Chase Bank, N.A.","Glasgow, UK",https://stackoverflow.com/jobs/553524
Software Engineer ( JADE Catalog ) - Java - VP,"JPMorgan Chase Bank, N.A.","Glasgow, UK",https://stackoverflow.com/jobs/554638
Fullstack Java Developer - for a cloud-based language training solution,Speexx,No office location,https://stackoverflow.com/jobs/521936
Software Engineer,"JPMorgan Chase Bank, N.A.","Wilmington, DE",https://stackoverflow.com/jobs/554017
Senior FrontEnd Engineer - Angular,Hearst Magazines,"Chicago, IL",https://stackoverflow.com/jobs/491611
Software Engineering,"JPMorgan Chase Bank, N.A.","Jersey City, NJ",https://stackoverflow.com/jobs/554021
Software Engineer,"JPMorgan Chase Bank, N.A.","Wilmington, DE",https://stackoverflow.com/jobs/554016
JavaScript Developer (m/w/d) Full Stack,ZEIT Verlagsgruppe,"München, Deutschland",https://stackoverflow.com/jobs/545914
Senior Frontend Developer who loves to work on the Green Energy Transformation,HYDROGRID GmbH,"Vienna, Austria",https://stackoverflow.com/jobs/551865
Web developer,Intel Corporation,"Moscow, Russia",https://stackoverflow.com/jobs/530450
Frontend Entwickler:in,HUK-COBURG Versicherungsgruppe,"Coburg, Deutschland",https://stackoverflow.com/jobs/550610
Senior Front End Developer,Kindred Group PLC,Gibraltar,https://stackoverflow.com/jobs/554862
VP - Senior Software Engineer - Full Stack Developer,"JPMorgan Chase Bank, N.A.","Jersey City, NJ",https://stackoverflow.com/jobs/554143
KI-Entwickler (m/d/w),CompuGroup Medical Deutschland AGviaComputer Futures Solutions GmbH,"Koblenz, Deutschland",https://stackoverflow.com/jobs/524932
Senior Software Engineer,Viva Wallet,"Marousi, Greece",https://stackoverflow.com/jobs/541474
Java Software Engineer- Cloud,"JPMorgan Chase Bank, N.A.","Wilmington, DE",https://stackoverflow.com/jobs/553936
Software Engineer - Java - VP,"JPMorgan Chase Bank, N.A.","Glasgow, UK",https://stackoverflow.com/jobs/555686
Senior Frontend Engineer (React),Rodeo,"Amsterdam, Netherlands",https://stackoverflow.com/jobs/516002
"Senior Fullstack Engineer (Java, Angular)",Celonis,"Munich, Germany",https://stackoverflow.com/jobs/551992
Software Engineering,"JPMorgan Chase Bank, N.A.","Glasgow, UK",https://stackoverflow.com/jobs/555227
Senior Software Engineer Magnolia CMS,ti&m AG,"Zürich, Schweiz",https://stackoverflow.com/jobs/522313
Software Engineering,"JPMorgan Chase Bank, N.A.","Jersey City, NJ",https://stackoverflow.com/jobs/555351
Senior Full Stack Software Engineer,"JPMorgan Chase Bank, N.A.","Chicago, IL",https://stackoverflow.com/jobs/551891
Senior ReactJS UI/UX Developer,"JPMorgan Chase Bank, N.A.","Houston, TX",https://stackoverflow.com/jobs/553701
Full Stack JavaScript Engineer,"JPMorgan Chase Bank, N.A.","Columbus, OH",https://stackoverflow.com/jobs/551974
Senior Webentwickler/in (80-100%),bbv Software Services AG,"Zürich, Schweiz",https://stackoverflow.com/jobs/431192
Remote Experienced Frontend Engineer - React,"Theorem, LLC",No office location,https://stackoverflow.com/jobs/545691
Full Stack Engineer (Application Engineer),Rakuten,"Setagaya City, Japan",https://stackoverflow.com/jobs/527726
Senior UI/UX Developer,"JPMorgan Chase Bank, N.A.","Houston, TX",https://stackoverflow.com/jobs/553333
Medior/Senior .NET Developer (verschillende locaties in Vlaanderen),Cegeka Group,"Brussels, Belgium",https://stackoverflow.com/jobs/467789
Java Software Engineer,"JPMorgan Chase Bank, N.A.","Columbus, OH",https://stackoverflow.com/jobs/553176
Full Stack Engineer - Javascript / React - VP,"JPMorgan Chase Bank, N.A.","London, UK",https://stackoverflow.com/jobs/555573
Senior Test Automation Engineer (m/f/d),PAYBACK,"München, Deutschland",https://stackoverflow.com/jobs/542160
Full Stack Java Developer,"JPMorgan Chase Bank, N.A.","Plano, TX",https://stackoverflow.com/jobs/555404
Software Engineering,"JPMorgan Chase Bank, N.A.","Columbus, OH",https://stackoverflow.com/jobs/553179
Java/Angular Full Stack Software Engineer,"JPMorgan Chase Bank, N.A.","Houston, TX",https://stackoverflow.com/jobs/554731
Fullstack Developer (m/w/d),OBI Group Holding SE & Co. KGaA,"Köln, Deutschland",https://stackoverflow.com/jobs/533992
Software Entwickler (m/w/d) Java Webtechnologien,diconium GmbHviaComputer Futures Solutions GmbH,"Stuttgart, Deutschland",https://stackoverflow.com/jobs/526166
Software Developer: Java/Scala/Spring-Framework,"JPMorgan Chase Bank, N.A.","Jersey City, NJ",https://stackoverflow.com/jobs/554761
Senior Software Engineer - Equity,Bloomberg LP,"New York, NY",https://stackoverflow.com/jobs/516632
TypeScript Developer,Gamesys Group,"London, UK",https://stackoverflow.com/jobs/530147
Cloud Native Java Software Engineering,"JPMorgan Chase Bank, N.A.","Chicago, IL",https://stackoverflow.com/jobs/552671
Backend Developer PPaaS H/F,Worldline,"Paris, France",https://stackoverflow.com/jobs/521806
Software Engineering - ACE 3,"JPMorgan Chase Bank, N.A.","Plano, TX",https://stackoverflow.com/jobs/555621
Front-End Engineer,Mixam,"Watford, UK",https://stackoverflow.com/jobs/523992
Full Stack Developer,Ensign InfoSecurity (Cybersecurity) Pte Ltd,Singapore,https://stackoverflow.com/jobs/534276
Software Engineer,"JPMorgan Chase Bank, N.A.","Wilmington, DE",https://stackoverflow.com/jobs/555187
Software Engineering Lead,"JPMorgan Chase Bank, N.A.","Chicago, IL",https://stackoverflow.com/jobs/553302
Sr. Java Full-Stack Developer,"JPMorgan Chase Bank, N.A.","Houston, TX",https://stackoverflow.com/jobs/554815
Software Engineering - Java,"JPMorgan Chase Bank, N.A.","Glasgow, UK",https://stackoverflow.com/jobs/553572
Java UI/UX Developer,"JPMorgan Chase Bank, N.A.","Plano, TX",https://stackoverflow.com/jobs/555403
Software Engineer,"JPMorgan Chase Bank, N.A.","Wilmington, DE",https://stackoverflow.com/jobs/554018
Software Engineer - QA Automation,"JPMorgan Chase Bank, N.A.","Plano, TX",https://stackoverflow.com/jobs/553161
