title,company,location,link
"Software Engineering-Java, HTML, Javascript, CSS, Angular","JPMorgan Chase Bank, N.A.","Plano, TX",https://stackoverflow.com/jobs/554632
"Senior Software Engineer, Backend (Healthtech, Remote Options, Equity)",WELL Health Inc.,"Los Angeles, CA",https://stackoverflow.com/jobs/549971
Software Engineering Manager (m/f/div),Elinvar GmbH,"Berlin, Germany",https://stackoverflow.com/jobs/554683
Lead Software Engineer (m/f/div),Elinvar GmbH,"Berlin, Germany",https://stackoverflow.com/jobs/555842
Senior Backend Engineer (m/f/div),Elinvar GmbH,"Berlin, Germany",https://stackoverflow.com/jobs/548851
SAP-Anwendungsentwickler (m/w/div.),Schütz GmbH & Co. KGaA,"Selters(Westerwald), Deutschland",https://stackoverflow.com/jobs/551321
(Senior) Frontend Engineer – React.js (m/f/div),Elinvar GmbH,"Berlin, Germany",https://stackoverflow.com/jobs/548854
SAP-Basis Administrator (m/w/div.),Schütz GmbH & Co. KGaA,"Selters(Westerwald), Deutschland",https://stackoverflow.com/jobs/551323
Fullstack Web Developer (m/w/d) - JAVA / HTML / CSS,CTS EVENTIM AG & Co. KG aA,"Bremen, Deutschland",https://stackoverflow.com/jobs/531044
Software Developer - Full Stack,Intelliware Development Inc.,No office location,https://stackoverflow.com/jobs/535340
[REMOTE] Product Manager in remote-first browser games company,Crazy Games,No office location,https://stackoverflow.com/jobs/543542
Technical Director,Intelliware Development Inc.,No office location,https://stackoverflow.com/jobs/555744
Cloud Automation Engineer (m/w/d),Mimacom,"Stuttgart, Deutschland",https://stackoverflow.com/jobs/551994
Senior Laravel / VUE Developer (Remote),Curotec,No office location,https://stackoverflow.com/jobs/533450
Cloud Engineer - Where GovTech and FinTech Meet,PayIt,"Kansas City, MO",https://stackoverflow.com/jobs/555453
"Senior Software Engineer - Full-stack (Python, React)",Invitae Corporation,No office location,https://stackoverflow.com/jobs/522534
Software Engineer - Hypergrowth Biotech startup helping dogs!,Embark Veterinary Inc.,"Boston, MA",https://stackoverflow.com/jobs/526658
Senior Software Engineer,Leverege,"Rockville, MD",https://stackoverflow.com/jobs/468965
Software Architect (Django/Flask + React),Self Decode,No office location,https://stackoverflow.com/jobs/307459
Senior JavaScript Software Engineer,"JPMorgan Chase Bank, N.A.","Columbus, OH",https://stackoverflow.com/jobs/555856
"Full Stack Software Engineer, Business Integrity",ByteDance,Singapore,https://stackoverflow.com/jobs/553099
Frontend Engineer at Bosch IoT Start-up,Azena (A Bosch IoT Start-Up),"Eindhoven, Netherlands",https://stackoverflow.com/jobs/522738
Software Developers for our offices in Germany and UK,Evotec SE,"Hamburg, Germany",https://stackoverflow.com/jobs/524299
Front-End Software Engineer,HENNGE K.K.,"Tokyo, Japan",https://stackoverflow.com/jobs/381280
Full-Stack Web Developer (m/w/d) Remote,asgoodasnew electronics GmbH,"Berlin, Deutschland",https://stackoverflow.com/jobs/529765
Python Developer (Remote),Finsera,No office location,https://stackoverflow.com/jobs/524065
Full-Stack Web Developer (m/w/d) Remote,asgoodasnew electronics GmbH,"Berlin, Deutschland",https://stackoverflow.com/jobs/529765
Python Entwickler*in Remote (f/m/d),Ambient,"Köln, Deutschland",https://stackoverflow.com/jobs/493874
"Senior Software Developer/Team Leader in Berlin, Hamburg or Göttingen",Evotec SE,"Berlin, Germany",https://stackoverflow.com/jobs/550234
"Frontend Software Engineer, Business Integrity",ByteDance,Singapore,https://stackoverflow.com/jobs/553035
Remote Software Architect,O'Reilly Auto Parts,No office location,https://stackoverflow.com/jobs/554580
(Senior) Frontend Engineer (all genders) - Remote or Relocation,Goodgame Studios,"Hamburg, Deutschland",https://stackoverflow.com/jobs/553440
JavaScript UI Software Engineer,"JPMorgan Chase Bank, N.A.","Columbus, OH",https://stackoverflow.com/jobs/554291
Software Developer - Redis/Kafka/Elasticsearch/MongoDB,Worldline,"Mumbai, India",https://stackoverflow.com/jobs/536705
Full-Stack Developer (m/f/d),AerQ GmbH,"Hamburg, Deutschland",https://stackoverflow.com/jobs/546686
Software Developer Vue.js (m/f/d),shopware AG,"Schöppingen, Deutschland",https://stackoverflow.com/jobs/549078
C#.Net Software Engineer - cxLoyalty  AWS a plus,"JPMorgan Chase Bank, N.A.","Plano, TX",https://stackoverflow.com/jobs/552849
Java Software Engineer,"JPMorgan Chase Bank, N.A.","Plano, TX",https://stackoverflow.com/jobs/554006
Backend Developer (m/w/d),edith.care GmbH,"Hamburg, Deutschland",https://stackoverflow.com/jobs/392887
Software Developer - APIs,"JPMorgan Chase Bank, N.A.","Jersey City, NJ",https://stackoverflow.com/jobs/555690
Staff Software Engineer - Hypergrowth Biotech startup helping dogs!,Embark Veterinary Inc.,"Boston, MA",https://stackoverflow.com/jobs/510445
BNPL with a Modern Tech Stack is Looking for a backend developer (Remote),ViaBill A/S,No office location,https://stackoverflow.com/jobs/371587
JavaScript Developer for Video Surveillance System,IPConfigure,"Norfolk, VA",https://stackoverflow.com/jobs/529255
Senior Front-end Developer (Remote),SORAMITSU,"Innopolis, Russia",https://stackoverflow.com/jobs/522571
Full Stack Software Engineer,Stable Kernel,"Atlanta, GA",https://stackoverflow.com/jobs/555631
(Senior) Frontend Developer (m/w/d),asgoodasnew electronics GmbH,"Berlin, Deutschland",https://stackoverflow.com/jobs/536573
Backend Software Engineer,Armored Things,"Boston, MA",https://stackoverflow.com/jobs/322319
JavaScript UI Software Engineer,"JPMorgan Chase Bank, N.A.","Plano, TX",https://stackoverflow.com/jobs/552382
Software Engineering - Full-Stack / JavaScript / React /Node JS,"JPMorgan Chase Bank, N.A.","Jersey City, NJ",https://stackoverflow.com/jobs/553085
Full Stack Software Engineer - ESG - AM Research Technology,"JPMorgan Chase Bank, N.A.","London, UK",https://stackoverflow.com/jobs/554360
Software Developer - APIs,"JPMorgan Chase Bank, N.A.","London, UK",https://stackoverflow.com/jobs/555348
Python Developer (Remote),Finsera,No office location,https://stackoverflow.com/jobs/524065
Remote Senior Software Developer - Pricing,O'Reilly Auto Parts,No office location,https://stackoverflow.com/jobs/554579
Frontend Engineer,alfaview GmbH,No office location,https://stackoverflow.com/jobs/267102
Backend Developer (m/w/d),edith.care GmbH,"Hamburg, Deutschland",https://stackoverflow.com/jobs/392887
ArcGIS for Office,Esri,"Redlands, CA",https://stackoverflow.com/jobs/523598
Full-Stack Technical Lead,SSENSE,"Montreal, QC, Canada",https://stackoverflow.com/jobs/521742
Sr. Full Stack Engineer- Python,AutoTrader,"Toronto, ON, Canada",https://stackoverflow.com/jobs/529021
Senior Python/Django Full-stack Developer,Apicbase Belgium,No office location,https://stackoverflow.com/jobs/545356
Senior Java Software Engineer (US Remote based),RBW ConsultingviaRBW Consulting,No office location,https://stackoverflow.com/jobs/554678
Junior Full Stack Engineer,Personio,"Dublin, Ireland",https://stackoverflow.com/jobs/552300
Java Software Engineer,"JPMorgan Chase Bank, N.A.","Plano, TX",https://stackoverflow.com/jobs/552381
Remote Software Engineer - Full Stack Java,O'Reilly Auto Parts,No office location,https://stackoverflow.com/jobs/554578
Senior Front-end Developer (Remote),SORAMITSU,"Innopolis, Russia",https://stackoverflow.com/jobs/522571
Java Software Engineer,"JPMorgan Chase Bank, N.A.","Columbus, OH",https://stackoverflow.com/jobs/554987
Software Engineer - Frontend / Fullstack (m/w/d),HolidayCheck Group AG,"Munich, Germany",https://stackoverflow.com/jobs/297719
React Front End Developer,"Daupler, Inc.","Kansas City, MO",https://stackoverflow.com/jobs/523351
FullStack Software Engineer,"JPMorgan Chase Bank, N.A.","Chicago, IL",https://stackoverflow.com/jobs/555710
Java Entwickler:in / Software Developer (m/w/d),Thalia Bücher GmbH,"Münster, Deutschland",https://stackoverflow.com/jobs/538578
Senior Full Stack Software Engineer - ESG - AM Research Technology,"JPMorgan Chase Bank, N.A.","London, UK",https://stackoverflow.com/jobs/553536
Backend Software Engineer,Armored Things,"Boston, MA",https://stackoverflow.com/jobs/322319
Frontend Engineer 80-100% (f/m/d),tutti.ch,"Berlin, Germany",https://stackoverflow.com/jobs/550413
Vue.js Developer (Remote),X-Team,No office location,https://stackoverflow.com/jobs/534462
Java Software Engineer,"JPMorgan Chase Bank, N.A.","Plano, TX",https://stackoverflow.com/jobs/552383
Software-Entwickler für JavaScript / Node.js Applikationen (m/w/d) [100% Remote,elunic AG,No office location,https://stackoverflow.com/jobs/555595
JAVA FullStack Software Engineering,"JPMorgan Chase Bank, N.A.","Chicago, IL",https://stackoverflow.com/jobs/555709
Backend Engineer,Tessian,"London, UK",https://stackoverflow.com/jobs/547936
(Senior) Fullstack Entwickler (m/w/d),BoschviaComputer Futures Solutions GmbH,"Stuttgart, Deutschland",https://stackoverflow.com/jobs/525341
FullStack Software Engineer,"JPMorgan Chase Bank, N.A.","Chicago, IL",https://stackoverflow.com/jobs/555710
Java Entwickler:in / Software Developer (m/w/d),Thalia Bücher GmbH,"Münster, Deutschland",https://stackoverflow.com/jobs/538578
Full Stack Developer (Django + React),Self Decode,No office location,https://stackoverflow.com/jobs/524866
Software Engineer - Backend Node.js,adidas Zaragoza Tech Hub,"Zaragoza, Spain",https://stackoverflow.com/jobs/503427
Web-Frontend-Entwickler (D/M/W),PRADTKE GMBH,"Bochum, Deutschland",https://stackoverflow.com/jobs/527865
Senior Python/Django Full-stack Developer,Apicbase Belgium,No office location,https://stackoverflow.com/jobs/515716
Full Stack Engineer,Singapore Innovate Pte. Ltd,Singapore,https://stackoverflow.com/jobs/554455
Technical Sales Engineer (f/m/d),AddApptr GmbH,"Hamburg, Germany",https://stackoverflow.com/jobs/552000
Senior Java Fullstack Developer: contribute E2E from server side to API & the UI,Mimecast,"London, UK",https://stackoverflow.com/jobs/415192
Full Stack Software Engineer,Stable Kernel,"Atlanta, GA",https://stackoverflow.com/jobs/555631
Softwareentwickler (m/w/d) Frontend / Backend / Fullstack (mehrere Standorte),AUSY Technologies Germany AG,"München, Deutschland",https://stackoverflow.com/jobs/521824
Software Developer Digitalisierung (m/w/d),Schwäbische Werkzeugmaschinen GmbH,"Schramberg, Deutschland",https://stackoverflow.com/jobs/555263
"Front End Developer - Angular, JavaScript, jQuery, Agile, TypeScript",Mimecast,"London, UK",https://stackoverflow.com/jobs/376558
Javascript & PHP Entwickler(in) für spannende Webapplikationen,4eyes GmbH,"Basel, Schweiz",https://stackoverflow.com/jobs/420062
Full-Stack Technical Lead,SSENSE,"Austin, TX",https://stackoverflow.com/jobs/521737
Intertoob Scanner Builder (Fullstack Engineer),Carve Systems,"Golden, CO",https://stackoverflow.com/jobs/517498
Senior Java Entwickler / Java Developer Frontend und Backend (m/w/d),IDAP Informationsmanagement GmbH,"Hürth, Deutschland",https://stackoverflow.com/jobs/552511
Software Engineer - Technical Learning Solutions,"JPMorgan Chase Bank, N.A.","London, UK",https://stackoverflow.com/jobs/553881
Junior/Senior Java Software Entwickler (m/w/d),"HPV e.G.viaProgressive, ein Geschäftszweig der SThree GmbH","Hamburg, Germany",https://stackoverflow.com/jobs/525365
Software Engineer Visualization (m/w/d),Oerlikon Barmag Zweigniederlassung der Oerlikon Textile GmbH & Co. KG,"Remscheid, Deutschland",https://stackoverflow.com/jobs/548749
Software Engineering,"JPMorgan Chase Bank, N.A.","Columbus, OH",https://stackoverflow.com/jobs/551861
Junior Software Developer (m/w/d) Ruby on Rails,Sektor N GmbH,"Hamburg, Germany",https://stackoverflow.com/jobs/550737
Software Allrounder (m/f/d),AnyDesk Software GmbH,"Stuttgart, Germany",https://stackoverflow.com/jobs/430745
Software Engineer Visualization (m/w/d),Oerlikon Barmag Zweigniederlassung der Oerlikon Textile GmbH & Co. KG,"Remscheid, Deutschland",https://stackoverflow.com/jobs/548749
Full Stack Java Software Engineer,"JPMorgan Chase Bank, N.A.","Columbus, OH",https://stackoverflow.com/jobs/553816
Senior Java Entwickler / Java Developer Frontend und Backend (m/w/d),IDAP Informationsmanagement GmbH,"Hürth, Deutschland",https://stackoverflow.com/jobs/552511
Software Engineer - Technical Learning Solutions,"JPMorgan Chase Bank, N.A.","London, UK",https://stackoverflow.com/jobs/553881
Java Software Engineer,"JPMorgan Chase Bank, N.A.","Jersey City, NJ",https://stackoverflow.com/jobs/554930
Front End Software Engineer – HPC Products,DUG Technology,"West Perth, Australia",https://stackoverflow.com/jobs/528137
Senior Frontend Software Engineer (m/f/d),zooplus AG,"München, Germany",https://stackoverflow.com/jobs/524555
Senior Full-Stack Developer (Remote),Slido,"Bratislava, Slovakia",https://stackoverflow.com/jobs/519749
React Developer (m/f/d) for leading eCommerce ecosystem for the energy world,epilot,"Köln, Deutschland",https://stackoverflow.com/jobs/486010
Java Software Engineer,"JPMorgan Chase Bank, N.A.","Columbus, OH",https://stackoverflow.com/jobs/554646
Frontend Web Developer (m/w/d),EyeC GmbH,"Hamburg, Deutschland",https://stackoverflow.com/jobs/408135
React Front End Developer,"Daupler, Inc.","Kansas City, MO",https://stackoverflow.com/jobs/523351
Software Developer - APIs,"JPMorgan Chase Bank, N.A.","London, UK",https://stackoverflow.com/jobs/555348
Full-Stack Software Developer (Intermediate / Senior),Derivco.,"Hope Island, Australia",https://stackoverflow.com/jobs/550295
Casino games frontend developer,Giocaonline s.r.l.,"Milan, Italy",https://stackoverflow.com/jobs/512667
Senior Full Stack Engineer at Leading Education Company,Tynker,No office location,https://stackoverflow.com/jobs/494562
Software Entwickler*in OmniTracker (m/w/d),Stadtwerke München GmbH,"München, Deutschland",https://stackoverflow.com/jobs/516837
System – and Database- Administrator (f/m/d),AddApptr GmbH,"Hamburg, Germany",https://stackoverflow.com/jobs/272132
Senior Software Engineer (React),Higher Logic,"Montreal, QC, Canada",https://stackoverflow.com/jobs/536301
Senior Frontend Engineer,Singapore Innovate Pte. Ltd,Singapore,https://stackoverflow.com/jobs/529920
Software Engineering,"JPMorgan Chase Bank, N.A.","Jersey City, NJ",https://stackoverflow.com/jobs/554438
Software-Entwickler für JavaScript / Node.js Applikationen (m/w/d) [100% Remote,elunic AG,No office location,https://stackoverflow.com/jobs/555595
Frontend Developer Squla,Futurewhiz,"Amsterdam, Netherlands",https://stackoverflow.com/jobs/529180
Software Developer Digitalisierung (m/w/d),Schwäbische Werkzeugmaschinen GmbH,"Schramberg, Deutschland",https://stackoverflow.com/jobs/555263
Full Stack Java Software Engineer,"JPMorgan Chase Bank, N.A.","Columbus, OH",https://stackoverflow.com/jobs/553816
Full-stack / front-end / back-end -kehittäjiä luomaan älykkäitä kaupunkeja,Sitowise,"Espoo, Finland",https://stackoverflow.com/jobs/488336
Informatiker als Fullstack Entwickler Web Development für Audioprodukte (m/w/d),Sennheiser electronic GmbH & Co. KG,"Wedemark, Deutschland",https://stackoverflow.com/jobs/509390
"Frontend Engineer, Studios Applications",Amazon.Com Inc.,"Culver City, CA",https://stackoverflow.com/jobs/540233
Senior Software Engineer (SEO),KAYAKviaInvest Lithuania,"Kaunas, Lithuania",https://stackoverflow.com/jobs/543987
Staff Software Engineer - OPEN TO REMOTE,The RealReal,No office location,https://stackoverflow.com/jobs/530699
Senior Frontend Engineer - Databento (Fully Remote),Unusual Ventures,No office location,https://stackoverflow.com/jobs/524277
Senior Software Engineer (Fullstack),Even Financial,"New York, NY",https://stackoverflow.com/jobs/460779
Software Engineer - Backend Node.js,adidas Zaragoza Tech Hub,"Zaragoza, Spain",https://stackoverflow.com/jobs/503427
Senior Web/Mobile Developer (m/w/d),Lotum GmbH,"Frankfurt am Main, Deutschland",https://stackoverflow.com/jobs/372988
Frontend Developer Squla,Futurewhiz,"Amsterdam, Netherlands",https://stackoverflow.com/jobs/529180
Software Engineering,"JPMorgan Chase Bank, N.A.","Jersey City, NJ",https://stackoverflow.com/jobs/554438
Java Software Engineer,"JPMorgan Chase Bank, N.A.","Jersey City, NJ",https://stackoverflow.com/jobs/554930
Senior Frontend Software Engineer (m/f/d),zooplus AG,"München, Germany",https://stackoverflow.com/jobs/524555
Senior Software Engineer,Keystone Collections Group,"Irwin, PA",https://stackoverflow.com/jobs/552170
Senior Full Stack Developer at Kogan.com,We Are Common,"Melbourne, Australia",https://stackoverflow.com/jobs/531156
Senior Backend Software Engineer (US Only),"Pie Insurance Holdings, Inc.",No office location,https://stackoverflow.com/jobs/545524
Software Engineer – JavaScript + React,zooplus AG,"Kraków, Poland",https://stackoverflow.com/jobs/545496
Experienced Vuejs UX/UI frontend developer (m/f/d),metoda GmbH,"München, Deutschland",https://stackoverflow.com/jobs/539496
Software Entwickler*in OmniTracker (m/w/d),Stadtwerke München GmbH,"München, Deutschland",https://stackoverflow.com/jobs/516837
"Software Engineer (Java and JavaScript, SQL and PL/SQL) 100% Remote",Western Governors University,No office location,https://stackoverflow.com/jobs/545685
Senior Frontend Software Engineer - (f/m/d),zooplus AG,"Madrid, Spain",https://stackoverflow.com/jobs/555448
React Software Engineer @ Nozomi Networks,Nozomi Networks,"Mendrisio, Switzerland",https://stackoverflow.com/jobs/526403
Software Architect Storefront (m/f/d),shopware AG,No office location,https://stackoverflow.com/jobs/548439
Senior Frontend Software Engineer (Angular/Javascript),Celonis,"Madrid, Spain",https://stackoverflow.com/jobs/551995
Web Applications Developer,"JPMorgan Chase Bank, N.A.","Tampa, FL",https://stackoverflow.com/jobs/552195
"Software Engineer (Java and JavaScript, SQL and PL/SQL) 100% Remote",Western Governors University,No office location,https://stackoverflow.com/jobs/545685
Java Fullstack Software Engineer,"JPMorgan Chase Bank, N.A.","Chicago, IL",https://stackoverflow.com/jobs/553983
Experienced Vuejs UX/UI frontend developer (m/f/d),metoda GmbH,"München, Deutschland",https://stackoverflow.com/jobs/539496
Senior Backend Software Engineer (US Only),"Pie Insurance Holdings, Inc.",No office location,https://stackoverflow.com/jobs/545524
Senior Frontend Software Engineer (Angular/Javascript),Celonis,"Madrid, Spain",https://stackoverflow.com/jobs/551995
Software Entwickler*in OmniTracker (m/w/d),Stadtwerke München GmbH,"München, Deutschland",https://stackoverflow.com/jobs/516837
Senior Software Engineer - Frontend,VIZIO,"Denver, CO",https://stackoverflow.com/jobs/522670
Senior Software Engineer - Front End,Keap,No office location,https://stackoverflow.com/jobs/492300
"Senior Software Engineer, UI- Pet Health- R8094","Chewy, Inc.","Minneapolis, MN",https://stackoverflow.com/jobs/513973
"Senior Software Engineer, UI - Pet Health-R8094","Chewy, Inc.","Boston, MA",https://stackoverflow.com/jobs/513971
UI Software Engineer,"JPMorgan Chase Bank, N.A.","Jersey City, NJ",https://stackoverflow.com/jobs/554089
Software Architect Storefront (m/f/d),shopware AG,No office location,https://stackoverflow.com/jobs/548439
.Net Software Developer,Geotab,No office location,https://stackoverflow.com/jobs/528786
Frontend Software Engineer,"JPMorgan Chase Bank, N.A.","Plano, TX",https://stackoverflow.com/jobs/554777
Experienced Front End Engineer,AE nv/sa,"Leuven, Belgium",https://stackoverflow.com/jobs/523553
Senior Software Engineer Web Front-end,ti&m AG,"Bern, Schweiz",https://stackoverflow.com/jobs/522271
Software Developer - Department for Education,Government Digital Service (GDS),"London, UK",https://stackoverflow.com/jobs/552302
Fullstack Developer,funda,"Amsterdam, Netherlands",https://stackoverflow.com/jobs/517353
"Senior Software Engineer, (Javascript/Typescript, React/Redux,Node)",Even Financial,"New York, NY",https://stackoverflow.com/jobs/546723
Senior Python Engineer - Back End - Take Charge Of Our In-House CMS,Immersive Labs,No office location,https://stackoverflow.com/jobs/552495
Senior UI ReactJS Software Engineer,"JPMorgan Chase Bank, N.A.","Houston, TX",https://stackoverflow.com/jobs/552940
Senior Software Engineer Web Front-end,ti&m AG,"Zürich, Schweiz",https://stackoverflow.com/jobs/522252
Senior Software Engineer Web-Front-end / .NET,ti&m AG,"Zürich, Schweiz",https://stackoverflow.com/jobs/522251
Software Engineering - JPMWM Technology,"JPMorgan Chase Bank, N.A.","Jersey City, NJ",https://stackoverflow.com/jobs/554756
Portfolio Core Team - Software Developer - Senior Associate,"JPMorgan Chase Bank, N.A.","London, UK",https://stackoverflow.com/jobs/555531
UI Software Engineer,"JPMorgan Chase Bank, N.A.","Jersey City, NJ",https://stackoverflow.com/jobs/554089
Software Allrounder (m/f/d),AnyDesk Software GmbH,"Stuttgart, Germany",https://stackoverflow.com/jobs/430745
Junior Frontend Web Developer,Network Guard,Hong Kong,https://stackoverflow.com/jobs/527724
Frontend Engineer (VueJS) - Full/Parttime,Paessler AG,No office location,https://stackoverflow.com/jobs/552996
Senior Software Engineer,Keystone Collections Group,"Irwin, PA",https://stackoverflow.com/jobs/552170
"(Senior) Frontend Engineer (m/w/d), Köln oder Gütersloh",Schüttflix GmbH,"Cologne, Germany",https://stackoverflow.com/jobs/525579
Senior Frontend Engineer (JS TS React),Zoopla,"London, UK",https://stackoverflow.com/jobs/496547
Sr. Front-End Software Developer,ProQuest,No office location,https://stackoverflow.com/jobs/555479
Junior JavaScript developer,SofteqviaInvest Lithuania,"Vilnius, Lithuania",https://stackoverflow.com/jobs/543978
Frontend Developer - for a cloud-based language training solution,Speexx,No office location,https://stackoverflow.com/jobs/524579
(Senior) Full Stack Developer (m/w/d) in München,jambit GmbH,"München, Deutschland",https://stackoverflow.com/jobs/528008
Senior Front End Engineer (Remote),Slido,"Bratislava, Slovakia",https://stackoverflow.com/jobs/519966
Backend Java Developer,Tradeshift,"București, Romania",https://stackoverflow.com/jobs/533090
Senior Software Engineer ( React ) (m / f / d),Usercentrics GmbH,"München, Deutschland",https://stackoverflow.com/jobs/525710
Senior Software Engineer- Order Management System- R10501,"Chewy, Inc.","Boston, MA",https://stackoverflow.com/jobs/555654
Web Developer wanting to join a fast growing company,BigChange Ltd,"Leeds, UK",https://stackoverflow.com/jobs/268103
Senior Software Engineer- Order Management System- R10501,"Chewy, Inc.","Minneapolis, MN",https://stackoverflow.com/jobs/555655
Product Frontend Developer,Flowable,No office location,https://stackoverflow.com/jobs/536068
UK-Based Remote Full Stack Web Developer (Angular / NodeJS / AWS),WUSTL International,No office location,https://stackoverflow.com/jobs/518475
Senior TypeScript and .Net Developer,MapLarge,"Atlanta, GA",https://stackoverflow.com/jobs/482097
Cloud Automation Engineer,tribe29 GmbH,"München, Deutschland",https://stackoverflow.com/jobs/547843
Senior Front-end Engineer,Reaktor,"Lisboa, Portugal",https://stackoverflow.com/jobs/554381
Software Engineering,"JPMorgan Chase Bank, N.A.","Chicago, IL",https://stackoverflow.com/jobs/555792
Team Leader - Software Engineering,Labforward GmbH,"Berlin, Germany",https://stackoverflow.com/jobs/553110
Senior Front End Engineer,Demand.io,"Los Angeles, CA",https://stackoverflow.com/jobs/555644
Senior Software Engineer- Order Management System- R10501,"Chewy, Inc.","Minneapolis, MN",https://stackoverflow.com/jobs/555655
Product Frontend Developer,Flowable,No office location,https://stackoverflow.com/jobs/536068
Frontend Developer (m/w/d) – Karlsruhe oder 100% Remote,Sovendus GmbH,"Karlsruhe, Deutschland",https://stackoverflow.com/jobs/552514
UK-Based Remote Full Stack Web Developer (Angular / NodeJS / AWS),WUSTL International,No office location,https://stackoverflow.com/jobs/518475
DevOps Engineer,Invitae Corporation,"Boulder, CO",https://stackoverflow.com/jobs/522515
Senior TypeScript and .Net Developer,MapLarge,"Atlanta, GA",https://stackoverflow.com/jobs/482097
Cloud Automation Engineer,tribe29 GmbH,"München, Deutschland",https://stackoverflow.com/jobs/547843
Senior Front-end Engineer,Reaktor,"Lisboa, Portugal",https://stackoverflow.com/jobs/554381
Software Engineering,"JPMorgan Chase Bank, N.A.","Chicago, IL",https://stackoverflow.com/jobs/555792
Backend Developer (m/w/d) remote,best it AG,"Berlin, Deutschland",https://stackoverflow.com/jobs/513393
Javascript Engineer,Adaptavist,"London, UK",https://stackoverflow.com/jobs/522044
Senior Software Engineer- Order Management System- R10501,"Chewy, Inc.","Dania Beach, FL",https://stackoverflow.com/jobs/555653
Senior Software Engineer,uShip,"Austin, TX",https://stackoverflow.com/jobs/537938
Web Developer (m/f/d),Ravensburger AG,"Malmö, Schweden",https://stackoverflow.com/jobs/499585
"Experienced React + VanillaJS Engineer, FinTech",TotallyMoney,"London, UK",https://stackoverflow.com/jobs/316009
Senior Software Developer (m/w/d) Ruby on Rails,Sektor N GmbH,"Hamburg, Germany",https://stackoverflow.com/jobs/550735
Senior Front-end Developer (Vue.js),Insider,"Berlin, Germany",https://stackoverflow.com/jobs/551196
Senior Front-End JavaScript Engineer,Canva,"Sydney, Australia",https://stackoverflow.com/jobs/150823
Software Engineer - Articulate 360,Articulate Inc.,No office location,https://stackoverflow.com/jobs/508367
Software Engineers,Eurovision Services,"Madrid, Spain",https://stackoverflow.com/jobs/504593
Frontend Developer / Headless Expert,Magnolia International Ltd.,No office location,https://stackoverflow.com/jobs/525573
Senior Full Stack Developer (m/f/d) in Yerevan,jambit GmbH,"Jerewan, Armenien",https://stackoverflow.com/jobs/528003
